{
  "schema_version": 1,
  "run_id": "attempt-3",
  "case_id": "duffel-real-lhr-jfk-search-select-revalidate",
  "attempt": 1,
  "evaluation_mode": "deterministic_live_provider",
  "started_at": "2026-08-09T09:53:43.148175Z",
  "completed_at": "2026-08-09T09:53:45.925555Z",
  "fingerprint": {
    "project_version": "0.1.0",
    "code_revision": "workspace-v1.0.2-20260809-final",
    "dataset_id": "duffel-real-revalidation-smoke-v1",
    "dataset_version": "1.0.0",
    "dataset_sha256": "b995025f8b44c170b06eabc3102f7378a0e8625b52a628038cc64dd640dfffd9",
    "prompt_version": null,
    "requested_model": null,
    "actual_model": null,
    "runner_version": "agent-eval-runner-v1",
    "price_table_version": null
  },
  "tool_choice_exposure": "orchestrator_controlled",
  "steps": [
    {
      "sequence": 1,
      "kind": "audit",
      "status": "success",
      "started_at": "2026-08-09T09:53:43.189762Z",
      "duration_ms": 0.0,
      "state_before": "DRAFT",
      "state_after": "DRAFT",
      "name": "TASK_CREATED",
      "tool_kind": null,
      "tool_call_sequence": null,
      "redacted_input": {
        "arrive_by": "2026-09-17T00:00:00+00:00",
        "created_at": "2026-08-09T09:53:43.189586+00:00",
        "departure_after": "2026-09-15T00:00:00+00:00",
        "destination": "JFK",
        "hard_constraints": [
          "flight_only"
        ],
        "hotel_check_in": null,
        "hotel_check_out": null,
        "origin": "LHR",
        "return_after": null,
        "return_before": null,
        "soft_preferences": [],
        "task_id": "duffel-real-lhr-jfk-search-select-revalidate-attempt-1",
        "traveler_id": "[REDACTED]",
        "version": 1
      },
      "input_hash": "206efd2f1275a7495350fa219b1b9e72baadbf337498e9568af85ed90f2eaca3",
      "output_hash": "cabaec81abc5de86953eb6d6a1a5edce5466a4a0b8a800fd8c59f678161fc018",
      "evidence_refs": [],
      "error_type": null,
      "error_message_code": null,
      "error_layer": null,
      "error_cause_type": null,
      "error_cause_chain": [],
      "response_received": null,
      "http_status": null,
      "provider_request_id": null,
      "retryable": null,
      "retry_of": null,
      "reason_code": null,
      "token_usage": null
    },
    {
      "sequence": 2,
      "kind": "state_transition",
      "status": "success",
      "started_at": "2026-08-09T09:53:43.190022Z",
      "duration_ms": 0.0,
      "state_before": "DRAFT",
      "state_after": "SEARCHING",
      "name": "STATE_TRANSITION",
      "tool_kind": null,
      "tool_call_sequence": null,
      "redacted_input": {
        "value": "DRAFT"
      },
      "input_hash": "c6741366c1b7c3d698949046d43e41a0cc5942adfb7839202accbc4d3ef43476",
      "output_hash": "155c75e201499b034c85fe6446a44a6facd1e14b65fd0d3344c3b114952461a2",
      "evidence_refs": [],
      "error_type": null,
      "error_message_code": null,
      "error_layer": null,
      "error_cause_type": null,
      "error_cause_chain": [],
      "response_received": null,
      "http_status": null,
      "provider_request_id": null,
      "retryable": null,
      "retry_of": null,
      "reason_code": null,
      "token_usage": null
    },
    {
      "sequence": 3,
      "kind": "tool",
      "status": "success",
      "started_at": "2026-08-09T09:53:43.190065Z",
      "duration_ms": 2376.5505,
      "state_before": "SEARCHING",
      "state_after": "SEARCHING",
      "name": "provider.search_transport.outbound",
      "tool_kind": "PROVIDER",
      "tool_call_sequence": 1,
      "redacted_input": {
        "arrive_before": "2026-09-17T00:00:00+00:00",
        "depart_after": "2026-09-15T00:00:00+00:00",
        "destination": "JFK",
        "origin": "LHR"
      },
      "input_hash": "f5a01635e51e1147991b53ac9f5dcc7459636fd73af58640c2d6514ff1626c3e",
      "output_hash": "eca0eaa3a1bfc26a79f0e334ea494fb6bc7ce14b70d8ab4aab2bedfef95d274f",
      "evidence_refs": [
        "off_0000B9BzZbRrGigsD5A5nm",
        "off_0000B9BzZbQRLzYY8gUxan",
        "off_0000B9BzZbRVI2PIByzoFW",
        "off_0000B9BzZbQRLzYY8gUxak",
        "off_0000B9BzZk6D6Zip2Y6Qoh",
        "off_0000B9BzZk3jFnjkuqwRx4",
        "off_0000B9BzZk6v3wHz4kQzuy",
        "off_0000B9BzZk9ktOYdDXlGLa",
        "off_0000B9BzZkASql7nFk5pRb",
        "off_0000B9BzZk92w1zTBLQhEW",
        "off_0000B9BzZk92w1zTBLQhEo",
        "off_0000B9BzZk7yzz8j82vqZz",
        "off_0000B9BzZk4nBqaUy9RIc1",
        "off_0000B9BzZk7yzz8j82vqZe",
        "off_0000B9BzZkA6s4qDEdvXtP",
        "off_0000B9BzZkA6s4qDEdvXtX",
        "off_0000B9BzZk6v3wHz4kQzv6",
        "off_0000B9BzZk6v3wHz4kQzvE",
        "off_0000B9BzZk4nBqaUy9RIbL",
        "off_0000B9BzZk6D6Zip2Y6QoS",
        "off_0000B9BzZkA6s4qDEdvXt3",
        "off_0000B9BzZk3jFnjkuqwRxC",
        "off_0000B9BzZk45EU1Kvx6jUj",
        "off_0000B9BzZkKOFr43kWjkuh",
        "off_0000B9BzZkLoAaCNovOt7Z",
        "off_0000B9BzZkNa3zcHuQEIsu",
        "off_0000B9BzZk8gxLhtAFGPh3",
        "off_0000B9BzZkMA9GTxq1ZAfz",
        "off_0000B9BzZkMs6d37sDtjmO",
        "off_0000B9BzZk9ktOYdDXlGLm",
        "off_0000B9BzZkMW7wlXr7jSEF",
        "off_0000B9BzZkKkEXLdlcu2TB",
        "off_0000B9BzZkLSBtunnpEbZM",
        "off_0000B9BzZkMs6d37sDtjmx",
        "off_0000B9BzZk3NH7SAtkmAO8",
        "off_0000B9BzZk3NH7SAtkmAOE",
        "off_0000B9BzZk3NH7SAtkmAOK",
        "off_0000B9BzZk3NH7SAtkmAOQ",
        "off_0000B9BzZk3NH7SAtkmAOW",
        "off_0000B9BzZk3NH7SAtkmAOc",
        "off_0000B9BzZk3NH7SAtkmAOi",
        "off_0000B9BzZk3NH7SAtkmAOo"
      ],
      "error_type": null,
      "error_message_code": null,
      "error_layer": null,
      "error_cause_type": null,
      "error_cause_chain": [],
      "response_received": null,
      "http_status": null,
      "provider_request_id": null,
      "retryable": null,
      "retry_of": null,
      "reason_code": null,
      "token_usage": null
    },
    {
      "sequence": 4,
      "kind": "audit",
      "status": "success",
      "started_at": "2026-08-09T09:53:45.567372Z",
      "duration_ms": 0.0,
      "state_before": "SEARCHING",
      "state_after": "SEARCHING",
      "name": "PROVIDER_COVERAGE_INCOMPLETE",
      "tool_kind": null,
      "tool_call_sequence": null,
      "redacted_input": {
        "value": [
          "duffel-flight-c14f48a36e1e471d: Duffel Test Mode sandbox inventory; schedules and prices are not production data",
          "duffel-flight-c14f48a36e1e471d: Duffel response was capped at 50 normalized offers"
        ]
      },
      "input_hash": "7e6fec702b60b4b8eb1123ef87789f7ce3342dc48e2381a893d90a697b6c7667",
      "output_hash": "155c75e201499b034c85fe6446a44a6facd1e14b65fd0d3344c3b114952461a2",
      "evidence_refs": [],
      "error_type": null,
      "error_message_code": null,
      "error_layer": null,
      "error_cause_type": null,
      "error_cause_chain": [],
      "response_received": null,
      "http_status": null,
      "provider_request_id": null,
      "retryable": null,
      "retry_of": null,
      "reason_code": null,
      "token_usage": null
    },
    {
      "sequence": 5,
      "kind": "audit",
      "status": "success",
      "started_at": "2026-08-09T09:53:45.567427Z",
      "duration_ms": 0.0,
      "state_before": "SEARCHING",
      "state_after": "SEARCHING",
      "name": "INVENTORY_SNAPSHOT_CAPTURED",
      "tool_kind": null,
      "tool_call_sequence": null,
      "redacted_input": {
        "value": "765579264b747e31c9f4a686667d46db69fd1437658952483d81553be1f514d2"
      },
      "input_hash": "8e64b776bc49465fe3cd0fa83f8f06002b05b20c6b187b1910305c3a203e5c21",
      "output_hash": "5cd30b9c2882834671f440f8f4aa9f7ae56e438bd2d6dc4edb8a8b73305a15c4",
      "evidence_refs": [
        "off_0000B9BzZbRrGigsD5A5nm",
        "off_0000B9BzZbQRLzYY8gUxan",
        "off_0000B9BzZbRVI2PIByzoFW",
        "off_0000B9BzZbQRLzYY8gUxak",
        "off_0000B9BzZk6D6Zip2Y6Qoh",
        "off_0000B9BzZk3jFnjkuqwRx4",
        "off_0000B9BzZk6v3wHz4kQzuy",
        "off_0000B9BzZk9ktOYdDXlGLa",
        "off_0000B9BzZkASql7nFk5pRb",
        "off_0000B9BzZk92w1zTBLQhEW",
        "off_0000B9BzZk92w1zTBLQhEo",
        "off_0000B9BzZk7yzz8j82vqZz",
        "off_0000B9BzZk4nBqaUy9RIc1",
        "off_0000B9BzZk7yzz8j82vqZe",
        "off_0000B9BzZkA6s4qDEdvXtP",
        "off_0000B9BzZkA6s4qDEdvXtX",
        "off_0000B9BzZk6v3wHz4kQzv6",
        "off_0000B9BzZk6v3wHz4kQzvE",
        "off_0000B9BzZk4nBqaUy9RIbL",
        "off_0000B9BzZk6D6Zip2Y6QoS",
        "off_0000B9BzZkA6s4qDEdvXt3",
        "off_0000B9BzZk3jFnjkuqwRxC",
        "off_0000B9BzZk45EU1Kvx6jUj",
        "off_0000B9BzZkKOFr43kWjkuh",
        "off_0000B9BzZkLoAaCNovOt7Z",
        "off_0000B9BzZkNa3zcHuQEIsu",
        "off_0000B9BzZk8gxLhtAFGPh3",
        "off_0000B9BzZkMA9GTxq1ZAfz",
        "off_0000B9BzZkMs6d37sDtjmO",
        "off_0000B9BzZk9ktOYdDXlGLm",
        "off_0000B9BzZkMW7wlXr7jSEF",
        "off_0000B9BzZkKkEXLdlcu2TB",
        "off_0000B9BzZkLSBtunnpEbZM",
        "off_0000B9BzZkMs6d37sDtjmx",
        "off_0000B9BzZk3NH7SAtkmAO8",
        "off_0000B9BzZk3NH7SAtkmAOE",
        "off_0000B9BzZk3NH7SAtkmAOK",
        "off_0000B9BzZk3NH7SAtkmAOQ",
        "off_0000B9BzZk3NH7SAtkmAOW",
        "off_0000B9BzZk3NH7SAtkmAOc",
        "off_0000B9BzZk3NH7SAtkmAOi",
        "off_0000B9BzZk3NH7SAtkmAOo"
      ],
      "error_type": null,
      "error_message_code": null,
      "error_layer": null,
      "error_cause_type": null,
      "error_cause_chain": [],
      "response_received": null,
      "http_status": null,
      "provider_request_id": null,
      "retryable": null,
      "retry_of": null,
      "reason_code": null,
      "token_usage": null
    },
    {
      "sequence": 6,
      "kind": "state_transition",
      "status": "success",
      "started_at": "2026-08-09T09:53:45.567457Z",
      "duration_ms": 0.0,
      "state_before": "SEARCHING",
      "state_after": "PLANNING",
      "name": "STATE_TRANSITION",
      "tool_kind": null,